{
  "schemaVersion": 1,
  "key": "magnolia_esmp_job_search",
  "name": "Magnolia ESMP Jobsuche",
  "kind": "website_family",
  "detect": {
    "phases": ["http"],
    "required": [
      {
        "fetchScript": {
          "srcRegex": "/webresources/js/.*script\\.js",
          "contains": "/.search?index=job"
        }
      },
      {
        "fetchJson": {
          "url": "/.search?index=job&size=1&page=1",
          "pathExists": "$.searchResults"
        }
      }
    ]
  },
  "accessPaths": [
    {
      "key": "endpoint_inventory",
      "adapterKey": "declarative_endpoint_inventory",
      "availability": {
        "sourceConfig": {
          "startUrl": "{{inputUrl}}",
          "endpointUrl": "{{origin}}/.search?index=job"
        }
      },
      "sourceConfigSchema": {
        "type": "object",
        "required": ["startUrl", "endpointUrl"],
        "additionalProperties": false,
        "properties": {
          "startUrl": {
            "type": "string",
            "format": "uri",
            "title": "Start-URL"
          },
          "endpointUrl": {
            "type": "string",
            "format": "uri",
            "pattern": "^https?://.+/\\.search\\?index=job$",
            "title": "Search-Endpoint"
          }
        }
      },
      "inventory": {
        "fetch": {
          "url": "{{sourceConfig:endpointUrl}}",
          "pagination": {
            "type": "page_count",
            "pageParam": "page",
            "sizeParam": "size",
            "size": 1000,
            "firstPage": 1,
            "totalPath": "$.total"
          }
        },
        "parse": {
          "as": "json"
        },
        "items": {
          "select": {
            "jsonPath": "$.searchResults"
          }
        },
        "fields": {
          "title": {
            "jsonPath": "$.title"
          },
          "url": {
            "jsonPath": "$.url"
          },
          "company": {
            "template": "{{sourceName}}"
          },
          "locations": [
            {
              "jsonPath": "$.location"
            }
          ]
        }
      }
    }
  ]
}
